,title
0,[KBS 전주]김현숙 여성가족부 장관 후보자는 국회에 제출한 서면질의 답변을 통해 윤석열 당선인의 여성가족부 폐지 공약에 동의한다고 밝혔습니다. 김 후보 …
1,"한동훈 법무장관 후보자는 조국 전 법무장관의 수사에 대해 ""어려운 여건에서 최선을 다했다고 생각한다. 과잉수사가 아니었다""고 밝혔습니다. 민형배 무소속  …"
2,한동훈 법무부 장관 후보자 인사 청문회에서는 더불어민주당 의원들의 날선 질문이 이어진 가운데 실소를 자아내는 장면도 포착됐습니다. 9일 국회에서 진행된  …
3,"이재명, 국민의힘 비난하며 “오등봉에서 해먹어” 원희룡 “이재명, 오등봉 반만 했어도…그냥 안 넘어가” 민주 “경기도망지사 발언, 보궐선거 개입” 원희룡 …"
4,문재인 대통령은 9일 “이전 정부들의 축적된 성과를 계승하고 발전시켜 더 국력이 커지고 더 나은 미래로 나아가길 기원한다”고 밝혔다. 문 대통령은 이날  …
5,"문재인 대통령이 퇴임 연설을 통해 ""지난 5년 위대한 국민과 함께한 것이 더없이 자랑스럽다""며 ""국민 모두의 행복을 기원하고 성공하는 대한민국의 역사를  …"
6,문재인 대통령이 임기 마지막 날인 9일 오후 5시54분께 청와대 본관을 나와 마지막 퇴근길에 올랐다. 문 대통령의 퇴근길에는 청와대 직원들 700여명이  …
7,"靑정문서 걸어 나와 퇴근…지지자 수천명 운집해 '문재인' 연호 靑 참모·민주당 출신 장관 등 배웅받으며 인사 文 ""전임 대통령으로서 '보기 좋구나' 소리 …"
8,"기사내용 요약 비나토 국가 다섯번째…아시아 최초 김선희 3차장 ""합동훈련 적극 참여"" 관계자 ""中, 나토 가입 오해…사실 아냐"" [서울=뉴한국의 나토 사 …"
9,우리나라의 북대서양조약기구(NATO·나토) 사이버방위센터(CCDCOE) 정회원 가입 행사가 지난 5일 오후(현지시간) 센터 본부가 있는 에스토니아 탈린에서 개최됐다. 9일 국가정보원에 따르면 이날 행사에는  …
10,임명 강행? 한덕수 인준 압박 카드? 윤석열 대통령 당선인이 장관 인사청문 정국의 중심 인물 중 하나인 정호영 보건복지부 장관 후보자를 비롯한 국무위원  …
11,"민주당, 한덕수 인준 부결 예고 18개 부처 절반 차관대행 출발 尹 ""비상계획도 고려하고 있어"" 윤석열 정부가 대통령직 인수 기간을 거치고도 정국 갈등의 …"
12,◀ 앵커 ▶ 윤석열 당선인의 최측근인 한동훈 법무부 장관 후보자에 대한 인사청문회가 오늘 열렸습니다. 한 후보자 딸의 논문 대필 의혹 등에 대해서 치열한 …
13,더불어민주당은 한동훈 법무장관 후보자의 인사청문회에서 후보자의 딸을 둘러싼 논란을 두고 '조국 사태'와 관련 연관해 공세했습니다. 김용민 민주당 의원은  …
14,윤석열 대통령 당선인이 10일 제20대 대통령에 공식 취임한다. 윤 당선인은 대통령 임기가 시작되는 10일 0시 정각에 용산 대통령실에서 군 통수권을 이 …
15,"박주선 취임준비위원장 인터뷰…""외관 화려함보다 검소한 취임식""尹 ""대통령실 용산 이전 분위기가 취임식에 나타나도록 준비해달라""취임식 후 집무실 인근 경로 …"
16,9일 오전 열린 경북 경산시장 시민후보 단일화 경선에서 오세혁 전 경북도의원이 선출됐다. 오 후보는 국민의힘 경산시장 후보 단수공천에 반발해 10명의 예 …
17,기사내용 요약 국힘 공천자 조현일·무소속 오세혁 후보 '1대1' 한판승부 전직 재선 경북도의원 출신 대결 [경산=뉴경북 경산시장 무소속 단일 후보는 오세 …
18,"공동연락사무소 통해 북측에 설명 요구…답변 아직 못 받아 北 미사일 발사 미보도에 ""다양한 가능성 두고 종합 평가중"" (서울=연합통일부는 9일 최근 개성 …"
19,경기도 파주시 접경지역에서 바라본 개성공단 일대의 모습. 북한의 남북공동연락사무소 폭파 시 충격으로 훼손된 개성공단지원센터가 방치되어 있다. (사진=연합 …
20,홍준표 국민의힘 대구시장 후보와 윤희숙 국민의힘 전 의원이 6.1 지방선거 당 공천을 놓고 한판 공방을 벌였다. 홍 후보는 9일 오전 이재명 더불어민주당 …
21,"홍준표 국민의힘 대구시장 후보는 9일, 지방선거 및 보궐선거 공천을 놓고 윤심(尹心) 팔이가 극성을 떨치고, 자신의 처지를 망각하는 일이 벌어지고 있다며 …"
22,] 더불어민주당이 정호영 보건복지부 장관 후보자와 원희룡 국토교통부 장관 후보자를 고발하겠다고 밝히는 등 윤석열 정부 첫 내각 인선에 강한 제동을 걸고  …
23,"정치 거래 성격으로 총리 인준 고민한 적 없어"" 법제사법위원장 합의 '원점 재논의' 입장 그대로 더불어민주당이 윤석열 정부의 정호영 보건복지부 장관 후보 …"
24,청문 정국의 최대 승부처로 관심을 모았던 한동훈 법무장관 후보자 청문회가 오늘(9일) 국회에서 열렸습니다. 민주당은 후보자 딸의 '스펙 쌓기' 논란이 조 …
25,"한상희 기자,윤다혜 더불어민주당은 9일 열린 한동훈 법무부 장관 후보자의 인사청문회에서 한 후보자의 딸이 두 달 사이에 2편의 논문을 국제 학술지에 게재 …"
26,"기사내용 요약 윤석열 ""한일 양국 관계 개선 통해 이룰 성과 많아"" 하토야마 ""미래지향적 관계 구축 위해 양국 노력"" [서울=뉴윤석열 대통령 당선인은 9 …"
27,윤석열 대통령 당선인이 하토야마 유키오 전 일본 총리를 만나 한일 양국 관계 개선에 대해 의견을 교환하는 등 외교 행보를 이어갔습니다. 윤 당선인은 오늘 …
28,"한국의 실리콘밸리로 불리는 성남시 판교 일대의 2018년 모습. 한 때 ‘판교 등대’로 불렸다. 밤에도 퇴근하지 않고, 야근하는 이들이 많다는 의미였다. 최근 IT기업과 스타트업을 중심으로 ‘주 52시간제’ …"
